{
  "version": 2,
  "name": "Eventos Operativos",
  "widgets": [
    {
      "id": "oe-stat-1",
      "componentId": "info_card",
      "layout": { "i": "oe-stat-1", "x": 0, "y": 0, "w": 8, "h": 5, "minW": 4, "minH": 4 },
      "config": {
        "title": "Eventos críticos activos",
        "icon": "chart",
        "value": "64",
        "descriptor": "últimas 24-48 horas",
        "aiPlaceholder": "La mayoría de los eventos críticos se concentran en 3 vehículos y ocurren fuera de horario.",
        "viewMoreUrl": "",
        "dataProvider": []
      },
      "children": [],
      "createdAt": "2025-01-01T00:00:00.000Z",
      "updatedAt": "2025-01-01T00:00:00.000Z"
    },
    {
      "id": "oe-stat-2",
      "componentId": "info_card",
      "layout": { "i": "oe-stat-2", "x": 8, "y": 0, "w": 8, "h": 5, "minW": 4, "minH": 4 },
      "config": {
        "title": "Vehículos con alta exposición",
        "icon": "chart",
        "value": "4",
        "descriptor": "requieren intervención prioritaria",
        "aiPlaceholder": "4 vehículos concentran la mayor cantidad de eventos y requieren atención inmediata.",
        "viewMoreUrl": "",
        "dataProvider": []
      },
      "children": [],
      "createdAt": "2025-01-01T00:00:00.000Z",
      "updatedAt": "2025-01-01T00:00:00.000Z"
    },
    {
      "id": "oe-stat-3",
      "componentId": "info_card",
      "layout": { "i": "oe-stat-3", "x": 16, "y": 0, "w": 8, "h": 5, "minW": 4, "minH": 4 },
      "config": {
        "title": "Tipo predominante",
        "icon": "chart",
        "value": "Velocidad",
        "descriptor": "60% del total",
        "aiPlaceholder": "Los eventos de velocidad representan la mayoría y se concentran en rutas interurbanas.",
        "viewMoreUrl": "",
        "dataProvider": []
      },
      "children": [],
      "createdAt": "2025-01-01T00:00:00.000Z",
      "updatedAt": "2025-01-01T00:00:00.000Z"
    },
    {
      "id": "oe-text-1",
      "componentId": "text_card",
      "layout": { "i": "oe-text-1", "x": 0, "y": 5, "w": 24, "h": 3 },
      "config": {
        "text": "\"La mayoría de los eventos críticos se concentran en 3 vehículos y ocurren fuera de horario.\"",
        "italic": true,
        "align": "left"
      },
      "createdAt": "2025-01-01T00:00:00.000Z",
      "updatedAt": "2025-01-01T00:00:00.000Z"
    }
  ],
  "preferences": {
    "editMode": false
  }
}
